{
  "$schema": "https://json-schema.org/draft/2020-12/schema",
  "title": "arc subrule pathway candidate packet",
  "type": "object",
  "required": [
    "packet_type",
    "write_status",
    "loop_name",
    "rules",
    "candidate_nodes",
    "candidate_pathways",
    "recommended_relationships",
    "manual_validation_required",
    "ledger"
  ],
  "additionalProperties": true,
  "properties": {
    "packet_type": {
      "type": "string"
    },
    "write_status": {
      "type": "string",
      "enum": [
        "candidate",
        "candidate_only",
        "no_graph_write",
        "do_not_write",
        "do_not_write_until_approved",
        "not_approved",
        "manual_validation_required",
        "candidate_only_no_graph_write_performed_do_not_write_until_approved"
      ]
    },
    "loop_name": {
      "type": "string"
    },
    "rules": {
      "type": "array",
      "minItems": 1
    },
    "companion_rules": {
      "type": "array"
    },
    "candidate_nodes": {
      "type": "array",
      "minItems": 1
    },
    "candidate_pathways": {
      "type": "array",
      "minItems": 1,
      "items": {
        "type": "object",
        "required": [
          "pathway_uid",
          "rule_anchor",
          "companion_rules",
          "case_ladder",
          "safe_formulation",
          "do_not_overstate_as",
          "manual_validation_status",
          "write_status"
        ],
        "additionalProperties": true,
        "properties": {
          "pathway_uid": {
            "type": "string"
          },
          "rule_anchor": {
            "type": "string"
          },
          "companion_rules": {
            "type": "array"
          },
          "source_material_classes": {
            "type": "array"
          },
          "use_purpose_classes": {
            "type": "array"
          },
          "proceeding_relationship_classes": {
            "type": "array"
          },
          "remedy_classes": {
            "type": "array"
          },
          "case_ladder": {
            "type": "array",
            "items": {
              "type": "object",
              "required": [
                "case_name",
                "neutral_citation",
                "court_level",
                "authority_level",
                "authority_role",
                "paragraphs",
                "paragraph_status",
                "holding_summary",
                "do_not_overstate_as",
                "current_status",
                "manual_status"
              ],
              "additionalProperties": true
            }
          },
          "safe_formulation": {
            "type": "string"
          },
          "do_not_overstate_as": {
            "type": "string"
          },
          "limits_or_exceptions": {
            "type": "array"
          },
          "authority_status": {
            "type": "string"
          },
          "manual_validation_status": {
            "type": "string"
          },
          "write_status": {
            "type": "string",
            "enum": [
              "candidate",
              "candidate_only",
              "no_graph_write",
              "do_not_write",
              "do_not_write_until_approved",
              "not_approved",
              "manual_validation_required",
              "candidate_only_no_graph_write_performed_do_not_write_until_approved"
            ]
          },
          "pathway_kind": {
            "type": "string",
            "enum": [
              "CASE_INTERPRETIVE",
              "RULE_TEXT_ONLY"
            ]
          },
          "source_proof_spans": {
            "type": "array"
          }
        }
      }
    },
    "recommended_relationships": {
      "type": "array"
    },
    "manual_validation_required": {
      "type": "boolean"
    },
    "discard_rules": {
      "type": "array"
    },
    "stop_escalation_conditions": {
      "type": "array"
    },
    "ledger": {
      "type": "object"
    }
  }
}
